<?xml version="1.0" encoding="UTF-8"?>
<!DOCTYPE manifest:manifest PUBLIC "-//OpenOffice.org//DTD Manifest 1.0//EN" "../../../../../../../package/dtd/Manifest.dtd">
<manifest:manifest xmlns:manifest="http://openoffice.org/2001/manifest">
 <manifest:file-entry manifest:full-path="/" manifest:media-type=""/>
 <manifest:file-entry manifest:full-path="O/atevent.xml" manifest:media-type="text/xml"/>
 <manifest:file-entry manifest:full-path="O/O.xml" manifest:media-type="text/xml"/>
 <manifest:file-entry manifest:full-path="ANY/atevent.xml" manifest:media-type="text/xml"/>
 <manifest:file-entry manifest:full-path="ANY/ANY.xml" manifest:media-type="text/xml"/>
 <manifest:file-entry manifest:full-path="OR/atevent.xml" manifest:media-type="text/xml"/>
 <manifest:file-entry manifest:full-path="OR/OR.xml" manifest:media-type="text/xml"/>
 <manifest:file-entry manifest:full-path="MVH/meta.xml" manifest:media-type="text/xml"/>
 <manifest:file-entry manifest:full-path="MVH/atevent.xml" manifest:media-type="text/xml"/>
 <manifest:file-entry manifest:full-path="MVH/settings.xml" manifest:media-type="text/xml"/>
 <manifest:file-entry manifest:full-path="MVH/content.xml" manifest:media-type="text/xml"/>
 <manifest:file-entry manifest:full-path="MVH/styles.xml" manifest:media-type="text/xml"/>
 <manifest:file-entry manifest:full-path="UA/meta.xml" manifest:media-type="text/xml"/>
 <manifest:file-entry manifest:full-path="UA/atevent.xml" manifest:media-type="text/xml"/>
 <manifest:file-entry manifest:full-path="UA/settings.xml" manifest:media-type="text/xml"/>
 <manifest:file-entry manifest:full-path="UA/content.xml" manifest:media-type="text/xml"/>
 <manifest:file-entry manifest:full-path="UA/styles.xml" manifest:media-type="text/xml"/>
 <manifest:file-entry manifest:full-path="P1/meta.xml" manifest:media-type="text/xml"/>
 <manifest:file-entry manifest:full-path="P1/atevent.xml" manifest:media-type="text/xml"/>
 <manifest:file-entry manifest:full-path="P1/settings.xml" manifest:media-type="text/xml"/>
 <manifest:file-entry manifest:full-path="P1/content.xml" manifest:media-type="text/xml"/>
 <manifest:file-entry manifest:full-path="P1/styles.xml" manifest:media-type="text/xml"/>
 <manifest:file-entry manifest:full-path="P2/meta.xml" manifest:media-type="text/xml"/>
 <manifest:file-entry manifest:full-path="P2/atevent.xml" manifest:media-type="text/xml"/>
 <manifest:file-entry manifest:full-path="P2/settings.xml" manifest:media-type="text/xml"/>
 <manifest:file-entry manifest:full-path="P2/content.xml" manifest:media-type="text/xml"/>
 <manifest:file-entry manifest:full-path="P2/styles.xml" manifest:media-type="text/xml"/>
 <manifest:file-entry manifest:full-path="ABM/atevent.xml" manifest:media-type="text/xml"/>
 <manifest:file-entry manifest:full-path="ABM/ABM.xml" manifest:media-type="text/xml"/>
 <manifest:file-entry manifest:full-path="LOREM/LOREM.xml" manifest:media-type="text/xml"/>
 <manifest:file-entry manifest:full-path="FN/content.xml" manifest:media-type="text/xml"/>
 <manifest:file-entry manifest:full-path="FN/Object_1/settings.xml" manifest:media-type="text/xml"/>
 <manifest:file-entry manifest:full-path="FN/Object_1/content.xml" manifest:media-type="text/xml"/>
 <manifest:file-entry manifest:full-path="FN/Object_1/" manifest:media-type="application/vnd.oasis.opendocument.formula"/>
 <manifest:file-entry manifest:full-path="FN/manifest.rdf" manifest:media-type="application/rdf+xml"/>
 <manifest:file-entry manifest:full-path="FN/styles.xml" manifest:media-type="text/xml"/>
 <manifest:file-entry manifest:full-path="FN/" manifest:media-type="application/vnd.oasis.opendocument.text"/>
 <manifest:file-entry manifest:full-path="UL/atevent.xml" manifest:media-type="text/xml"/>
 <manifest:file-entry manifest:full-path="UL/UL.xml" manifest:media-type="text/xml"/>
 <manifest:file-entry manifest:full-path="BT/atevent.xml" manifest:media-type="text/xml"/>
 <manifest:file-entry manifest:full-path="BT/BT.xml" manifest:media-type="text/xml"/>
 <manifest:file-entry manifest:full-path="B/B.xml" manifest:media-type="text/xml"/>
 <manifest:file-entry manifest:full-path="BV/atevent.xml" manifest:media-type="text/xml"/>
 <manifest:file-entry manifest:full-path="BV/BV.xml" manifest:media-type="text/xml"/>
 <manifest:file-entry manifest:full-path="AA/meta.xml" manifest:media-type="text/xml"/>
 <manifest:file-entry manifest:full-path="AA/atevent.xml" manifest:media-type="text/xml"/>
 <manifest:file-entry manifest:full-path="AA/settings.xml" manifest:media-type="text/xml"/>
 <manifest:file-entry manifest:full-path="AA/content.xml" manifest:media-type="text/xml"/>
 <manifest:file-entry manifest:full-path="AA/styles.xml" manifest:media-type="text/xml"/>
 <manifest:file-entry manifest:full-path="BlockList.xml" manifest:media-type="text/xml"/>
 <manifest:file-entry manifest:full-path="F/F.xml" manifest:media-type="text/xml"/>
 <manifest:file-entry manifest:full-path="ANS/meta.xml" manifest:media-type="text/xml"/>
 <manifest:file-entry manifest:full-path="ANS/atevent.xml" manifest:media-type="text/xml"/>
 <manifest:file-entry manifest:full-path="ANS/settings.xml" manifest:media-type="text/xml"/>
 <manifest:file-entry manifest:full-path="ANS/content.xml" manifest:media-type="text/xml"/>
 <manifest:file-entry manifest:full-path="ANS/styles.xml" manifest:media-type="text/xml"/>
 <manifest:file-entry manifest:full-path="AI/meta.xml" manifest:media-type="text/xml"/>
 <manifest:file-entry manifest:full-path="AI/atevent.xml" manifest:media-type="text/xml"/>
 <manifest:file-entry manifest:full-path="AI/settings.xml" manifest:media-type="text/xml"/>
 <manifest:file-entry manifest:full-path="AI/content.xml" manifest:media-type="text/xml"/>
 <manifest:file-entry manifest:full-path="AI/styles.xml" manifest:media-type="text/xml"/>
 <manifest:file-entry manifest:full-path="K/atevent.xml" manifest:media-type="text/xml"/>
 <manifest:file-entry manifest:full-path="K/K.xml" manifest:media-type="text/xml"/>
</manifest:manifest>